{
  "schemaVersion": 1,
  "generatedAt": "2026-08-29T04:20:02.797Z",
  "query": "Personal read-later / bookmark organizer with automatic categorization, read reminders, and cross-device (phone + laptop) sync",
  "candidates": [
    {
      "id": "url:https://readwise.io/read",
      "rank": 1,
      "title": "Readwise Reader",
      "url": "https://readwise.io/read",
      "kind": "web",
      "identities": [
        {
          "scheme": "url",
          "value": "https://readwise.io/read",
          "confidence": "derived"
        }
      ],
      "sourceCategories": [
        "web"
      ],
      "matchedCapabilities": [
        "read reminders / nudges"
      ],
      "evidenceRefs": [
        "https://readwise.io/read",
        "$"
      ],
      "features": {
        "lexicalFit": 1,
        "reciprocalRank": 1,
        "evidenceQuality": 0.65,
        "finalScore": 0.965
      },
      "explanations": [
        "Strong lexical fit with the functional fingerprint.",
        "Single-source observation.",
        "Mentions: read reminders / nudges."
      ],
      "observationCount": 1
    },
    {
      "id": "url:https://cubox.cc/",
      "rank": 2,
      "title": "Cubox",
      "url": "https://cubox.cc/",
      "kind": "web",
      "identities": [
        {
          "scheme": "url",
          "value": "https://cubox.cc/",
          "confidence": "derived"
        }
      ],
      "sourceCategories": [
        "web"
      ],
      "matchedCapabilities": [],
      "evidenceRefs": [
        "https://cubox.cc/",
        "$"
      ],
      "features": {
        "lexicalFit": 0.4909,
        "reciprocalRank": 1,
        "evidenceQuality": 0.65,
        "finalScore": 0.6341
      },
      "explanations": [
        "Limited lexical fit; verify manually.",
        "Single-source observation.",
        "No must-have capability mention detected."
      ],
      "observationCount": 1
    },
    {
      "id": "url:https://raindrop.io/",
      "rank": 3,
      "title": "Raindrop.io",
      "url": "https://raindrop.io/",
      "kind": "web",
      "identities": [
        {
          "scheme": "url",
          "value": "https://raindrop.io/",
          "confidence": "derived"
        }
      ],
      "sourceCategories": [
        "web"
      ],
      "matchedCapabilities": [],
      "evidenceRefs": [
        "https://raindrop.io/",
        "$"
      ],
      "features": {
        "lexicalFit": 0.4632,
        "reciprocalRank": 1,
        "evidenceQuality": 0.65,
        "finalScore": 0.6161
      },
      "explanations": [
        "Limited lexical fit; verify manually.",
        "Single-source observation.",
        "No must-have capability mention detected."
      ],
      "observationCount": 1
    },
    {
      "id": "github:karakeep-app/karakeep",
      "rank": 4,
      "title": "karakeep-app/karakeep",
      "url": "https://github.com/karakeep-app/karakeep",
      "kind": "repo",
      "identities": [
        {
          "scheme": "github",
          "value": "karakeep-app/karakeep",
          "confidence": "derived"
        },
        {
          "scheme": "url",
          "value": "https://github.com/karakeep-app/karakeep",
          "confidence": "derived"
        }
      ],
      "sourceCategories": [
        "repo"
      ],
      "matchedCapabilities": [],
      "evidenceRefs": [
        "https://github.com/karakeep-app/karakeep",
        "$"
      ],
      "features": {
        "lexicalFit": 0.2821,
        "reciprocalRank": 1,
        "evidenceQuality": 0.8,
        "finalScore": 0.5134
      },
      "explanations": [
        "Limited lexical fit; verify manually.",
        "Single-source observation.",
        "No must-have capability mention detected."
      ],
      "observationCount": 1
    },
    {
      "id": "url:https://raindrop.io/pro",
      "rank": 5,
      "title": "Raindrop.io Pro",
      "url": "https://raindrop.io/pro",
      "kind": "web",
      "identities": [
        {
          "scheme": "url",
          "value": "https://raindrop.io/pro",
          "confidence": "derived"
        }
      ],
      "sourceCategories": [
        "web"
      ],
      "matchedCapabilities": [],
      "evidenceRefs": [
        "https://raindrop.io/pro",
        "$"
      ],
      "features": {
        "lexicalFit": 0.214,
        "reciprocalRank": 1,
        "evidenceQuality": 0.65,
        "finalScore": 0.4541
      },
      "explanations": [
        "Limited lexical fit; verify manually.",
        "Single-source observation.",
        "No must-have capability mention detected."
      ],
      "observationCount": 1
    }
  ],
  "coverage": [
    {
      "capability": "automatic AI categorization/tagging without manual tagging",
      "status": "missing",
      "candidateIds": []
    },
    {
      "capability": "read reminders / nudges",
      "status": "candidate_mention",
      "candidateIds": [
        "url:https://readwise.io/read"
      ]
    },
    {
      "capability": "cross-device sync (phone + laptop)",
      "status": "missing",
      "candidateIds": []
    }
  ],
  "evidence": {
    "level": "weak",
    "basis": "heuristic_candidate_coverage",
    "missingCapabilities": [
      "automatic AI categorization/tagging without manual tagging",
      "cross-device sync (phone + laptop)"
    ],
    "sourceCategories": [
      "web",
      "repo"
    ],
    "needsFollowUp": true,
    "suggestedQueries": [
      "Personal read-later / bookmark organizer with automatic categorization, read reminders, and cross-device (phone + laptop) sync automatic AI categorization/tagging without manual tagging",
      "Personal read-later / bookmark organizer with automatic categorization, read reminders, and cross-device (phone + laptop) sync cross-device sync (phone + laptop)"
    ]
  },
  "retrieval": {
    "requests": 8,
    "failedRequests": 0,
    "normalizedRecords": 8,
    "rejectedRecords": 0,
    "warnings": [
      {
        "code": "missing_identity",
        "message": "No stable identity was found; cross-source merging is disabled.",
        "rawRef": "$"
      },
      {
        "code": "partial_item",
        "message": "Record is partial and will use only available signals.",
        "rawRef": "$"
      }
    ]
  },
  "metrics": {
    "uniqueCandidates": 8,
    "returnedCandidates": 5,
    "duplicateObservationsMerged": 0
  },
  "trace": [
    {
      "stage": "normalize",
      "detail": "8 records from 8 retrieval requests."
    },
    {
      "stage": "identity",
      "detail": "0 duplicate observations merged conservatively."
    },
    {
      "stage": "rank",
      "detail": "8 unique candidates scored with BM25F and RRF."
    },
    {
      "stage": "select",
      "detail": "5 candidates selected with lexical diversity and capability coverage."
    },
    {
      "stage": "evidence",
      "detail": "2 must-have capabilities still missing candidate mentions."
    }
  ]
}
